id,created_at,text,likes,in reply to,retweeted,Subjectivity,Polarity,Analysis
1152548891335770112,2019-07-20 12:00:43,designed with the gg motif in contrasting shades the gg tweed fabric defines guccidionysus bags discover more ,394,,False,0.5,0.5,Positive
1152488411602849793,2019-07-20 08:00:24,inspired by alessandromicheles vision for the show the guccimanifesto lineup of tshirts and sweatsh ,289,,False,0.0,0.0,Neutral
1152266270210973698,2019-07-19 17:17:41,guccimanifesto takes over the gucciartwall in milan hong kong and london discover more about the inspiration be ,403,,False,0.5,0.5,Positive
1152192213742424065,2019-07-19 12:23:25,the fashion show inspires the guccimanifesto prints in different colors reproducing the same designs t ,329,,False,0.3625,0.0,Neutral
1151959991496138764,2019-07-18 21:00:39,up close with guccimanifesto designs featuring masks by alessandromichele seen here two of the onlineexclusive ,297,,False,0.0,0.0,Neutral
1151899549532864512,2019-07-18 17:00:28,a mask features on the guccimanifesto sweatshirt some pieces of the collection are available exclusively online a ,330,,False,0.4,0.4,Positive
1151846622130769920,2019-07-18 13:30:09,the maskcolored and spikedseen in the show features on a guccimanifesto sweatshirtavailable exclusi ,315,,False,0.0,0.0,Neutral
1151476155398197254,2019-07-17 12:58:03,featuring the collection gucciprêtàporter documents a journey through the seasonal fashion wheel disc ,322,,False,0.0,0.0,Neutral
1151174114599718914,2019-07-16 16:57:51,paying homage to the passion of the fashion circuit an imaginary magazine cover features an image from ,327,,False,0.0,0.0,Neutral
1151065135496216576,2019-07-16 09:44:48,starring in the gucciprêtàporter campaign the new gucciultrapace sneaker combines a mix of fabrics colors and h ,392,,False,0.45454545454545453,0.13636363636363635,Positive
1150872822664847363,2019-07-15 21:00:37,imagined by alessandromichele the gucciprêtàporter campaign is a tale of fashion that spans four decades the  ,279,,False,0.0,0.0,Neutral
1150834967812947970,2019-07-15 18:30:12, performed at the party for guccixmelet mercantile store in montauk and created playlist sentimental ,261,,False,1.0,-0.25,Negative
1150827505093361665,2019-07-15 18:00:33,celebrating the guccixmelet mercantile store in montauk a summer party with guests siennamiller  ,282,,False,0.0,0.0,Neutral
1150799744555528194,2019-07-15 16:10:14,presenting gucciprêtàporter the campaign envisioned by alessandromichele music ascenseur pour le ,412,,False,0.0,0.0,Neutral
1150740821160996864,2019-07-15 12:16:06,presenting gucciprêtàporter inspired by the world of designers and their muses the campaign is concei ,327,,False,0.0,0.0,Neutral
1150684389245956098,2019-07-15 08:31:51,a journey through the seasonal fashion wheel gucciprêtàporter alessandromichele ,690,,False,0.0,0.0,Neutral
1150506035175665671,2019-07-14 20:43:08,images span through decades gucciprêtàporter alessandromichele ,586,,False,0.0,0.0,Neutral
1150435600098562048,2019-07-14 16:03:15,an ode to fashion gucciprêtàporter alessandromichele ,601,,False,0.0,0.0,Neutral
1150374534094213120,2019-07-14 12:00:36,rich colors in a mix of different fabrics including leather suede canvas and reflective fabric are constructed in ,365,,False,0.675,0.1875,Positive
1150314056504479745,2019-07-14 08:00:17,tailoring shapes and relaxed silhouettes featuring the collections prints define the womens lineup from ,309,,False,0.0,0.0,Neutral
1150132907597619203,2019-07-13 20:00:28,up close with the guccirajah tote featuring the tiger head finished with colored enamel and sparkling crystals d ,341,,False,0.0,0.0,Neutral
1150072567929147395,2019-07-13 16:00:42,the gg motif details velvet bags and luggage for men backpacks duffels and belt bags that also include the web st ,388,,False,0.0,0.0,Neutral
1150012099084587008,2019-07-13 12:00:25,mens loafers enriched with a combination of two of the houses most distinct codes the web stripe and horsebit d ,447,,False,0.4,0.4,Positive
1149951691262976001,2019-07-13 08:00:22,emblems of the house including the gg logo interlocking g and bee crest lend graphic pattern to a lineup of silk ,258,,False,0.4,0.0,Neutral
1149800773481615361,2019-07-12 22:00:41,paired with a guccizumi mini bag the leather belt with double g buckle continues to define looks by ,419,,False,0.0,0.0,Neutral
1149755597396553729,2019-07-12 19:01:10,a mainstay of gucci collections by alessandromichele a belt featuring the double g bucklean archival design fro ,435,,False,0.0,0.0,Neutral
1149700772424310785,2019-07-12 15:23:19,an archival reprisal of the houses emblem the double g hardware defines a multitude of gucci accessories includin ,628,,False,0.0,0.0,Neutral
1149596579914895360,2019-07-12 08:29:17,winner of the best college athlete award wore a guccidiy made to order signoria tuxedo evening s ,338,,False,0.3,1.0,Positive
1149408213936300032,2019-07-11 20:00:47, wore a wool silk doublebreasted jacket cotton long sleeve shirt and wool silk mini skirt from ,417,,False,0.4,-0.05,Negative
1149333939745673216,2019-07-11 15:05:39,to the premiere of disneys the lion king in hollywood california donald glover wore a doublebre ,388,,False,0.0,0.0,Neutral
1149045869402120194,2019-07-10 20:00:58,including shoulder bags buckets and mini designs the ggmarmont designs are crafted in matelassé leather with di ,428,,False,0.0,0.0,Neutral
1148985490055598081,2019-07-10 16:01:02,captured under a dark light looking at new ggmarmont styles the handbag collection is part of guccibeloved  d ,329,,False,0.5181818181818182,0.12878787878787878,Positive
1148983744059121665,2019-07-10 15:54:06,investing in technology has really been a way for me to challenge myself and grow im very curious and i love b ,424,,False,0.6,0.19000000000000003,Positive
1148980618920960000,2019-07-10 15:41:41,technology has been one of the biggest allies of people who havent been able to control the narrative on who gets ,209,,False,0.625,0.5,Positive
1148958470533726208,2019-07-10 14:13:40,if you want to run a luxury company you cant be pessimistic and im also optimistic about technology ai tells ,214,,False,0.0,0.0,Neutral
1148950299555586048,2019-07-10 13:41:12,talking about how avatars will influence human connection and connectivity at the fcfestival powered by at ,163,,False,0.1,0.0,Neutral
1148925129755435015,2019-07-10 12:01:11,a collection part of guccibeloved  alessandromichele has given the ggmarmont line a distinct look with the thr ,347,,False,0.3,0.3,Positive
1148909547316305920,2019-07-10 10:59:16,on the second day of the fcfestival at the guccihub scientist and professor and neuroscientist mora ,164,,False,0.0,0.0,Neutral
1148864021141053441,2019-07-10 07:58:22,captured through juliahettas lens in images inspired by flemish paintings the ggmarmont line of soft leather ma ,617,,False,0.35,0.1,Positive
1148743646340145153,2019-07-10 00:00:02,designed by alessandromichele with a twisted double g detailan archiveinspired stylizing of the initials of the ,496,,False,0.5,-0.25,Negative
1148698376004866052,2019-07-09 21:00:09,part of the guccibeloved  collectionsthe bags and shoes lines updated every new season the ggmarmont shoulder ,375,,False,0.45454545454545453,0.13636363636363635,Positive
1148653290705641472,2019-07-09 18:01:00,inspired by flemish paintings from the renaissance period photographer juliahetta captures the ggmarmont line p ,334,,False,0.0,0.0,Neutral
1148633946516787203,2019-07-09 16:44:08,racism has existed forever my hope is through the generations who use technology more folks can begin to peer i ,209,,False,0.5,0.5,Positive
1148605493214162946,2019-07-09 14:51:04,that machines can develop a conscious and understand a level of empathywe are very far away from that mainly beca ,224,,False,0.611111111111111,0.1322222222222222,Positive
1148603516434493441,2019-07-09 14:43:12,inside the guccihub at the fcfestival chief creative officer of soho house said i feel there is ,157,,False,1.0,0.5,Positive
1148578061933338625,2019-07-09 13:02:04,i believe that chefs can be more than the sum of their recipes talks to  ,144,,False,0.5,0.5,Positive
1148572289992146944,2019-07-09 12:39:08,mayor of milan spoke about the value of open society and immigration and the need for technology in cit ,156,,False,0.5,0.0,Neutral
1148570300260454400,2019-07-09 12:31:13,the main products of the century will be bodies brains and minds in his speech the end of h ,172,,False,0.3333333333333333,0.16666666666666666,Positive
1148538789666705408,2019-07-09 10:26:00,from his talk at s fcfestival powered by at the guccihub for billion years nothing funda ,149,,False,0.0,0.0,Neutral
1148526414184026112,2019-07-09 09:36:50,at the guccihub the first day of s european innovation festival powered by  speaking today h ,173,,False,0.16666666666666666,0.125,Positive
1148200300035092480,2019-07-08 12:00:58,contrasting fabrics leather and nylon meet in a new hybrid hiking and boat shoe laceup from by ,390,,False,0.45454545454545453,0.13636363636363635,Positive
1148139818729267201,2019-07-08 08:00:38,a new theme seen throughout the collection takes its motif from the archives a country club inspir ,521,,False,0.45454545454545453,0.13636363636363635,Positive
1147958579346989056,2019-07-07 20:00:28,presented in a range of different wool patterns the new horsebit loafer features elements that mimic slippers dis ,327,,False,0.5272727272727272,0.06818181818181818,Positive
1147899344475082754,2019-07-07 16:05:05,styled with readytowear looks from by alessandromichele silk scarves are adorned by a tiger pri ,408,,False,0.0,0.0,Neutral
1147837818556882944,2019-07-07 12:00:36,designed by alessandromichele a look at the new guccizumi grainy leather shoulder bags the handbag line is part ,586,,False,0.45454545454545453,0.13636363636363635,Positive
1147779470876643328,2019-07-07 08:08:45,a light shirt embellished with the gg motif combined with a colorful print part of guccitowardssummer by ,330,,False,0.55,0.35,Positive
1147625034103611393,2019-07-06 21:55:04,sheer guccibeauty lipstick rouge à lèvres voile by alessandromichele leaves an imprint of luminous colour on the ,731,,False,0.75,0.0,Neutral
1147566032078409730,2019-07-06 18:00:37,designed to enhance the natural smoothness and texture of the lips baume à lèvres lip balm shown in shade no m ,522,,False,0.4,0.1,Positive
1147505641000460290,2019-07-06 14:00:39,multitasker guccibeauty satin lipstick rouge à lèvres satin shade  crystal black can also be used to define ,500,,False,0.43333333333333335,-0.16666666666666666,Negative
1147445175926644736,2019-07-06 10:00:23,luminous individual the new hortus deliciarum high jewelry collection byalessandromichele is captured in the new ,742,,False,0.4622727272727273,0.10818181818181818,Positive
1147403666959286272,2019-07-06 07:15:26,in laurajanecoulsons short film wears the new guccihighjewelry pieces and performs at the petit ,737,,False,0.37727272727272726,0.06818181818181818,Positive
1147160427425619968,2019-07-05 15:08:53,at petit palais in paris to celebrate the launch of the first guccihighjewelry collection chairman and ceo of ,449,,False,0.3333333333333333,0.25,Positive
1147153186752479237,2019-07-05 14:40:07, performing at a gala dinner held at the petit palais to celebrate the first guccihighjewelry col ,343,,False,0.3333333333333333,0.25,Positive
1147112918389010433,2019-07-05 12:00:06,inside guccivendôme with wearing pieces from guccihighjewelry captured for a short film by ,938,,False,0.3,0.0,Neutral
1147092836266979333,2019-07-05 10:40:18,s hands reveal the light in the jewels of the guccihighjewelry collection hortus deliciarum by ,340,,False,0.7,0.4,Positive
1147083421220581377,2019-07-05 10:02:54,next week at the guccihub in milan s festival the dawn of superintelligence powered by  ju ,159,,False,0.0,0.0,Neutral
1147076580398784512,2019-07-05 09:35:43,launching soon a short film featuring directed by laurajanecoulson guccihighjewelry ,513,,False,0.3,0.0,Neutral
1146476365186813953,2019-07-03 17:50:40,alessandromichele channels his curiosity and curatorial instinct into the houses firstever guccihighjewelry col ,341,,False,0.0,0.0,Neutral
1146146766531772418,2019-07-02 20:00:58,activewear pieces adorned with house details and floral motifs from by alessandromichele discove ,337,,False,0.0,0.0,Neutral
1146121272163733505,2019-07-02 18:19:39,from by alessandromichele a hooded sweatshirt features a deer motif discover more ,471,,False,0.5,0.5,Positive
1146025878482247680,2019-07-02 12:00:36,a look at new laceup espadrilles in a mini gg fabric featuring a rubber sole part of towardssummer ,299,,False,0.3522727272727273,0.06818181818181818,Positive
1145784373381423105,2019-07-01 20:00:56,influenced by classic trainers from the  the gucciscreener sneakers feature the house web stripe and fabrics i ,445,,False,0.16666666666666666,0.16666666666666666,Positive
1145724211723472896,2019-07-01 16:01:53,enhanced with the gg logo a lineup of tweed readytowear pieces from by alessandromichele disco ,330,,False,0.0,0.0,Neutral
1145663739821264896,2019-07-01 12:01:35,imbued with a summer feel a wide brim hat in gg raffia and aviator sunglasses from by ,357,,False,0.4,-0.1,Negative
1145421858772267008,2019-06-30 20:00:26,dear to alessandromichele the guccibeloved  lines are updated with every new collection part of beloved is the ,397,,False,0.7272727272727273,0.41818181818181815,Positive
1145361588230262784,2019-06-30 16:00:57,from by alessandromichele a lineup of lowheel guccizumi mules discover more ,308,,False,0.5,0.5,Positive
1145301115816357889,2019-06-30 12:00:39,guccizumi is part of the guccibeloved  collections representing the accessories enamored by the house and their ,300,,False,0.0,0.0,Neutral
1145059479261724673,2019-06-29 20:00:28,gucciflora emerald gardenia is a newly blended version of the fragrance from the flora family green a colour emb ,333,,False,0.37727272727272726,-0.03181818181818183,Negative
1144999240516689920,2019-06-29 16:01:06,in an image from the new gucciflora emerald gardenia campaign ellia sophia lays on a bed of creamy white gardenia ,471,,False,0.22727272727272727,0.06818181818181818,Positive
1144968945880973313,2019-06-29 14:00:43,listen to the new guccipodcast episode featuring soul singer talking about his music lyrics and t ,192,,False,0.45454545454545453,0.13636363636363635,Positive
1144938738570715136,2019-06-29 12:00:41,presenting gucciflora emerald gardenia a limitededition fragrance full with fruity and floral notes layered on a ,364,,False,0.55,0.35,Positive
1144712274931847170,2019-06-28 21:00:48,kai from appears in the latest issue wearing a gg jacquard bomber jacket with matching sh ,20255,,False,0.9,0.5,Positive
1144651921493544960,2019-06-28 17:00:59,voguegreeces latest cover story photographed by yorgoslanthimos  who also captured art book whic ,402,,False,0.9,0.5,Positive
1144593794123411457,2019-06-28 13:10:00,featured in the june issue of  a guccidécor silk and velvet quilt wool pants and cotton socks from ,268,,False,0.0,0.0,Neutral
1144269127764385806,2019-06-27 15:39:54,sound on tracing the creation of a finished gucciace by alessandromichele from a ball of clay matched with diver ,664,,False,0.4,0.4,Positive
1144155565049942021,2019-06-27 08:08:38,sound on in oh jia haos video the gucciace sneaker by alessandromichele is cut by a blade topped wi ,643,,False,0.4,0.4,Positive
1143885023113875458,2019-06-26 14:13:36,sound on presenting the new videos featuring the gucciace sneaker by alessandromichele ,474,,False,0.42727272727272725,0.2681818181818182,Positive
1143832458384646144,2019-06-26 10:44:44,part of a series called folly rococo hut is an aluminium representation of a playhouse on show at ,305,,False,0.0,0.0,Neutral
1143610006497038338,2019-06-25 20:00:47,guests celebrating the unveiling of rachelfeinsteins works for artist in residence with a special dinner held a ,311,,False,0.5714285714285714,0.35714285714285715,Positive
1143561517209665538,2019-06-25 16:48:06,a new project parallel with alessandromicheles philosophy gucci and debut artist in residence ,269,,False,0.22727272727272727,0.06818181818181818,Positive
1143277772598628352,2019-06-24 22:00:36,a distinctive design of the house the lion head motif featuring a sparkling crystal held between its teeth defines ,415,,False,0.0,0.0,Neutral
1143232575034601472,2019-06-24 19:01:00,surrounded by house codes displayed as the watchs indexes the roaring tiger and the bee define new gtimeless wat ,384,,False,0.45454545454545453,0.13636363636363635,Positive
1143185714986782720,2019-06-24 15:54:48,the double g continues to define house collections including guccijewelry pieces designed by alessandromichele d ,274,,False,0.0,0.0,Neutral
1142885146993004548,2019-06-23 20:00:27,looking at new mens bowling shirts embellished with the house motifs and symbols part of the towardssummer ,336,,False,0.45454545454545453,0.13636363636363635,Positive
1142824941206814720,2019-06-23 16:01:13,up close with the new horsebit loafer in a light woven fabric from the towardssummer collection the design is enr ,359,,False,0.5772727272727273,0.2681818181818182,Positive
1142764413147111424,2019-06-23 12:00:42,from by alessandromichele a mens belt bag and a backpack in soft gg fabric embellished with a ti ,389,,False,0.35,0.1,Positive
1142522776101838859,2019-06-22 20:00:31,a new shape designed by alessandromichele the ggmarmont bucket bag is crafted in matelassé leather and decorated ,322,,False,0.45454545454545453,0.13636363636363635,Positive
1142462529429524480,2019-06-22 16:01:07,the gucciace sneaker is set on a platform and features the metallic bee against the house web since its debut th ,466,,False,0.0,0.0,Neutral
1142402057330221057,2019-06-22 12:00:49,presented in contrasting shades accentuated by diagonal stripes the guccizumi mini bucket bag is crafted from two ,255,,False,0.0,0.0,Neutral
1142190662198210561,2019-06-21 22:00:49,in the new the performers film in collaboration with and benjaminclementine from ,195,,False,0.45454545454545453,0.13636363636363635,Positive
1142145420321329158,2019-06-21 19:01:02,scenes from the new film in collaboration with and featuring  part of th ,293,,False,0.45454545454545453,0.13636363636363635,Positive
1142100511434432512,2019-06-21 16:02:35,florenceclementine from artistic and musical duo appears in the new act of the performers wearin ,191,,False,0.48484848484848486,0.15656565656565655,Positive
1142073969790652416,2019-06-21 14:17:07,see a video of artist director and photographer harmonykorine in conversation with american film director ,193,,False,0.0,0.0,Neutral
1142039828827181056,2019-06-21 12:01:27,the new the performers film unveils seeking new creative answers together rather than getting too ,143,,False,0.6363636363636364,0.25757575757575757,Positive
1142002085384327168,2019-06-21 09:31:29,created in collaboration with and  the performers new act features in th ,286,,False,0.45454545454545453,0.13636363636363635,Positive
1141755351504707585,2019-06-20 17:11:03,the performers video series in collaboration with and returns with a new short film feat ,246,,False,0.37727272727272726,0.06818181818181818,Positive
1141465848097513472,2019-06-19 22:00:40,wearing onlineexclusive guccimanifesto designs featuring masks by alessandromichele italian djs ,215,,False,0.0,0.0,Neutral
1141405577819635713,2019-06-19 18:01:10,behind the masks created by alessandromichele in a shoot for guccimanifestos onlineexclusive designs italian ,188,,False,0.35,-0.2,Negative
1141380340881219585,2019-06-19 16:20:53,see wu tsangs documentary which explores the history of house music into a space of love is part of the second ,171,,False,0.19999999999999998,0.16666666666666666,Positive
1141353321690796034,2019-06-19 14:33:31,on the onlineexclusive designs of a guccimanifesto tshirt and sweatshirt by alessandromichele italian djs ,211,,False,0.0,0.0,Neutral
1141043150506602496,2019-06-18 18:01:01,worn by silviacalderoni an onlineexclusive guccimanifesto tshirt printed with a maskthe romebased performanc ,247,,False,0.0,0.0,Neutral
1140988664278867969,2019-06-18 14:24:30,the maskcolored and spikedseen in features on onlineexclusive guccimanifesto tshirts and sw ,349,,False,0.0,0.0,Neutral
1140932814453596162,2019-06-18 10:42:35,presenting guccimanifesto an onlineexclusive collection of tshirts and sweatshirts inspired by ,266,,False,0.0,0.0,Neutral
1140892813661495297,2019-06-18 08:03:38,images from the guccitimepieces campaign portray and debunk the image of power in a series of meetandgreets wit ,215,,False,0.0,0.0,Neutral
1140710924229193729,2019-06-17 20:00:52,presenting the guccigrip a new watch designed by alessandromichele featuring a case with three windows indicating ,314,,False,0.45454545454545453,0.13636363636363635,Positive
1140665668007858177,2019-06-17 17:01:02,the new versions of the gtimeless automatic watch appears in images from the guccitimepieces campaign aiming to t ,229,,False,0.45454545454545453,0.13636363636363635,Positive
1140621484488122368,2019-06-17 14:05:28,a handshake is the protagonist of the new guccitimepieces campaign conceived by alessandromichele discover more ,247,,False,0.4772727272727273,0.3181818181818182,Positive
1140605239978078208,2019-06-17 13:00:55,presenting the new guccitimepieces campaign music my way sex pistols c francois  p anka j revaux  g th ,421,,False,0.45454545454545453,0.13636363636363635,Positive
1140542797474357248,2019-06-17 08:52:47,creative director alessandromichele conceived the new guccitimepieces campaign after being inspired by a simple g ,252,,False,0.6038961038961039,0.21212121212121213,Positive
1140348423650062342,2019-06-16 20:00:25,the cat head defines a guccijewelry pendant necklace crafted from sterling silver with an aged finish discover th ,413,,False,0.4,-0.1,Negative
1140288278589054976,2019-06-16 16:01:25,unconventional and modern guccizumi merges two of its most distinctive codes into one symbol the interlocking g ,429,,False,0.4,0.35,Positive
1140227777309941760,2019-06-16 12:01:01,sparkling crystals set on an aged goldtoned metal base embellish a strawberry detail defining a lineup of ,425,,False,0.7,-0.45,Negative
1139986084916596736,2019-06-15 20:00:37,a new and smaller silhouette designed by alessandromichele the gg velvet backpack features leather inserts and th ,586,,False,0.4772727272727273,0.06818181818181818,Positive
1139925743377498113,2019-06-15 16:00:50,gucciscreener the new house sneaker references retro shapes and materials inspired by vintage sportswear discov ,398,,False,0.45454545454545453,0.13636363636363635,Positive
1139896780781510657,2019-06-15 14:05:45,watch and travel to nakuwadde uganda to team up with action in africa  ,284,,False,0.1,0.1,Positive
1139865351813046273,2019-06-15 12:00:52,the distinctive gg motif is embedded into a soft velvet fabric defining a bucket bag and a backpack from ,356,,False,0.35,0.1,Positive
1139623768173830150,2019-06-14 20:00:54,featuring the house web stripe and the double gan archival detailnew leather wallets and card cases discover the ,531,,False,0.0,0.0,Neutral
1139563439414812672,2019-06-14 16:01:10,from by alessandromichele leather platform pumps with fringe details and the double g hardware d ,341,,False,0.0,0.0,Neutral
1139502835362648065,2019-06-14 12:00:21,looking at the new leather gucciophidia shoulder bag from by alessandromichele discover more ,341,,False,0.4772727272727273,0.3181818181818182,Positive
1139276438547435533,2019-06-13 21:00:44,filled with history objects anecdotes and geographies the guccigarden in florence presents sixexhibit rooms o ,1014,,False,0.9,0.4,Positive
1139215958625673216,2019-06-13 17:00:24,attending the opening of the new exhibition rooms liviacarpenzano and guccigarden galleria curator maria luisa f ,376,,False,0.45454545454545453,0.13636363636363635,Positive
1139147741974712320,2019-06-13 12:29:20,a new room at the guccigarden cosmic colours explores a palette that runs through the gucci collections with ,705,,False,0.45454545454545453,0.13636363636363635,Positive
1138929181079867393,2019-06-12 22:00:51,conceived by alessandromichele and curated by maria luisa frisa the room jardin dhiverwhich is french ,420,,False,0.0,0.0,Neutral
1138883847670632449,2019-06-12 19:00:43,presenting a new exhibition room at the guccigarden in florence cosmorama is a space full of luggage trunks an ,452,,False,0.5022727272727273,0.24318181818181817,Positive
1138863554868760576,2019-06-12 17:40:05,at the guccigarden in florence six new rooms welcome new narratives conceived by alessandromichele and curated b ,453,,False,0.603030303030303,0.3575757575757576,Positive
1138809711904604160,2019-06-12 14:06:08,unveiling new exhibits at the guccigarden in florence conceived by alessandromichele and curated by ,1292,,False,0.45454545454545453,0.13636363636363635,Positive
1138574159615877120,2019-06-11 22:30:07,featured in natasha lyonne wears a dress with pleated skirt and sleeves from ,434,,False,0.0,0.0,Neutral
1138528881470840837,2019-06-11 19:30:12, host james corden wore a one button shawl lapel jacket with contrast satin lapel and trou ,580,,False,0.0,0.0,Neutral
1138483610745528320,2019-06-11 16:30:19,to the held at presenter wore a gucci floral gown with crystal buttons ,355,,False,0.0,0.0,Neutral
1138362043445252096,2019-06-11 08:27:15,under the creative vision of alessandromichele film and stage director producer and screenwriter ,345,,False,1.0,0.5,Positive
1138204355591573515,2019-06-10 22:00:39,a cinematic exhibit in media partnership with harmony korine  the crackup will run from june to ,214,,False,0.2,0.0,Neutral
1138159102348144640,2019-06-10 19:00:50,celebrating the work of harmonykorine with a special exhibit dedicated to the director artist and screenwriter to ,220,,False,0.5714285714285714,0.35714285714285715,Positive
