id,created_at,text,likes,in reply to,retweeted,Subjectivity,Polarity,Analysis
1329937570789289985,2020-11-21 00:00:00,backstage moments photographed on set by paigepowell from the neighbours episode of the part series ouvert ,319,,False,0.0,0.0,Neutral
1329915032474447872,2020-11-20 22:30:27,episode  the neighbours  ouverture of something that never ended ,487,,False,0.0,0.0,Neutral
1329801677696868354,2020-11-20 15:00:01,therefore i am the song by in a video directed by harmonykorine features in the neighbours prem ,1310,,False,0.0,0.0,Neutral
1329771480725528579,2020-11-20 13:00:01,a look on set as captured by paigepowell episode the neighbours from ouverture of something that never ended ,364,,False,0.0,0.0,Neutral
1329741322119417857,2020-11-20 11:00:11,today at  cet the premiere of episode the neighbours from ouverture of something that never ended t ,268,,False,0.0,0.0,Neutral
1329711084031275008,2020-11-20 09:00:01, are seen in episode wearing reeditions of looks from alessandro micheles first coll ,302,,False,0.3333333333333333,0.25,Positive
1329680879300481025,2020-11-20 07:00:00,seen in the fourth episode and captured here by gusvansant actor and playwright wore a web tweed o ,312,,False,0.0,0.0,Neutral
1329575186220208128,2020-11-20 00:00:01,a gallery of looks featured in the fourth episode from ouverture of something that never ended captured by ,409,,False,0.0,0.0,Neutral
1329544986921078786,2020-11-19 22:00:01,sasha waltz and the dancers from her company  together with silviacalderoni and d ,290,,False,0.0,0.0,Neutral
1329514884019724288,2020-11-19 20:00:24,episode  the theatre  ouverture of something that never ended ,458,,False,0.0,0.0,Neutral
1329484589560078336,2020-11-19 18:00:01,the theatre the fourth episode from ouverture of something that never ended premiering today will feature acto ,313,,False,0.0,0.0,Neutral
1329439290242211840,2020-11-19 15:00:01,backstage of episode the theatre from the miniseries ouverture of something that never ended captured by ,391,,False,0.0,0.0,Neutral
1329409089353502724,2020-11-19 13:00:00,dancers warmup and get into costume for the theatre the new episode from ouverture of something that never ende ,365,,False,0.45454545454545453,0.13636363636363635,Positive
1329378891778015235,2020-11-19 11:00:01,the new guccibasket high top sneakers with fluorescent details worn with socks featuring s crest ,498,,False,0.4981818181818181,0.26545454545454544,Positive
1329355483845521408,2020-11-19 09:27:00,for his guest appearance in episode  wore a printed tshirt featuring the year  the year gucci ,17103,,False,0.0,0.0,Neutral
1329350570486992896,2020-11-19 09:07:28,looks designed by alessandromichele revealed in episode include printed tshirts mini bags and ,463,,False,0.0,0.0,Neutral
1329220344834629632,2020-11-19 00:30:00,backstage moments captured on set for episode at the post officethe new episode which features a conversation ,1408,,False,0.45454545454545453,0.13636363636363635,Positive
1329190464935911428,2020-11-18 22:31:16,,6778,,False,0.0,0.0,Neutral
1329141079891976195,2020-11-18 19:15:02,presenting the new collection in gucciouverture of something that never ended a film in episodes directed by ,1634,,False,0.45454545454545453,0.13636363636363635,Positive
1329119246870319106,2020-11-18 17:48:16,whos speaking in episode at the post office premiering today silviacalderoni listens in on a conversation w ,29827,,False,0.0,0.0,Neutral
1329109362099462145,2020-11-18 17:09:00,images captured by paigepowell inside a post office the set of episode from ouverture of something that never ,965,,False,0.0,0.0,Neutral
1329046145960644610,2020-11-18 12:57:48,today at  cet the premiere of episode at the post office from ouverture of something that never ended ,15101,,False,0.0,0.0,Neutral
1329038413505449985,2020-11-18 12:27:04,seen in episode at the café silviacalderoni carries the redesigned bamboo bag and wears a tshirt printed on ,604,,False,0.0,0.0,Neutral
1328986301048221696,2020-11-18 09:00:00, appears in episode at the café wearing a hooded sweatshirt tunic top layered over cotton pants wit ,430,,False,0.5,0.5,Positive
1328835311816777729,2020-11-17 23:00:01,captured by gusvansant new looks from alessandromicheles collection appear in episode at the café watch th ,448,,False,0.45454545454545453,0.13636363636363635,Positive
1328835276316270593,2020-11-17 22:59:53,photographer paigepowell shot moments from the making of at the café the second episode from ouverture of some ,311,,False,0.0,0.0,Neutral
1328790142459449345,2020-11-17 20:00:32,,836,,False,0.0,0.0,Neutral
1328744718361108481,2020-11-17 17:00:02,singer and poet will appear in episode at the café of ouverture of something that never ended the ,288,,False,0.0,0.0,Neutral
1328718250889383936,2020-11-17 15:14:52,on set for the miniseries ouverture of something that never ended images by paigepowell featuring a vintage ci ,437,,False,0.0,0.0,Neutral
1328679767848214534,2020-11-17 12:41:56,episode at the café of ouverture of something that never ended premieres at cet the miniseries directed ,353,,False,0.0,0.0,Neutral
1328623919796944899,2020-11-17 09:00:01,captured by gusvansant looks from alessandromicheles new collection are revealed in episode at home from o ,355,,False,0.45454545454545453,0.13636363636363635,Positive
1328593717305896961,2020-11-17 07:00:00,in episode at home writer philosopher and curator paulbpreciado wears a reedition of a look from ,288,,False,0.0,0.0,Neutral
1328503120901488643,2020-11-17 01:00:01,the opening episode of ouverture of something that never ended unfolds in an apartment in rome featuring vintage ,407,,False,0.0,0.0,Neutral
1328476988332511234,2020-11-16 23:16:10,photographed by paigepowell a series of images reveal the backstage of the first episode from ouverture of somet ,425,,False,0.3333333333333333,0.25,Positive
1328428220572721154,2020-11-16 20:02:23,episode  at home  ouverture of something that never ended ,1658,,False,0.0,0.0,Neutral
1328383177174491139,2020-11-16 17:03:24,writer philosopher and curator paulbpreciado features alongside silviacalderoni in episode of ouverture of so ,404,,False,0.0,0.0,Neutral
1328322396898668545,2020-11-16 13:01:53,backstage moments with gusvansant alessandromichele and silviacalderoni for ouverture of something that never ,416,,False,0.0,0.0,Neutral
1328089035340996611,2020-11-15 21:34:35,debuting tomorrow at cet episode at home from ouverture of something that never ended directed by ,511,,False,0.0,0.0,Neutral
1327717947251585028,2020-11-14 21:00:01,announced on the gucciartwall in nyc the first of a part film series ouverture of something that never ended ,337,,False,0.3333333333333333,0.25,Positive
1327657549366059008,2020-11-14 17:00:01,the gucciartwall presents ouverture of something that never ended the part film series directed by gusvansant ,280,,False,0.0,0.0,Neutral
1327599497661345792,2020-11-14 13:09:20,the gucciartwall announces the premiere of ouverture of something that never ended the series featuring the new ,284,,False,0.45454545454545453,0.13636363636363635,Positive
1327390786040844290,2020-11-13 23:19:59,featured in images from the guccigrip collaborative project is grip a timepiece with a clean streamlined design ,376,,False,0.7000000000000001,0.3666666666666667,Positive
1327385758949203968,2020-11-13 23:00:01,listed to the new guccipodcast episode to hear ellefanning deepdive into her directorial debut for ,167,,False,0.45454545454545453,0.13636363636363635,Positive
1327343878035427336,2020-11-13 20:13:36,among the protagonists of guccigrip is musician and skateboarder cherstrauberry captured by and ,264,,False,0.0,0.0,Neutral
1327311505008816129,2020-11-13 18:04:57,a joyful portrait of action creativity inclusion sociability and subculture for guccigrip sports passionate f ,301,,False,0.47500000000000003,0.025,Positive
1327288356607315969,2020-11-13 16:32:58,on the cover of s december issue wears gucciepilogue captured by an ,41367,,False,0.0,0.0,Neutral
1327240627768209414,2020-11-13 13:23:19,for the new guccigrip collaborative project protagonists show how sport can be inclusive and creative while wear ,298,,False,0.7272727272727273,0.3181818181818182,Positive
1327215697471090688,2020-11-13 11:44:15,professional skateboarder leobaker captured by melissabuenowoerner for guccigrip the collaborative project feat ,225,,False,0.1,0.1,Positive
1327151567976476673,2020-11-13 07:29:25,a breakdancer basketball players skateboarders and a rollerskater are captured freestyling their moves in the n ,269,,False,0.0,0.0,Neutral
1327006286811107330,2020-11-12 21:52:08,harnessing the passion of a variety of sports enthusiasts the guccigrip collaborative project returns with a new ,290,,False,0.45454545454545453,0.13636363636363635,Positive
1326939454049837058,2020-11-12 17:26:33,saralancerio captured for guccigrip by miriam marlene waldner in berlin featured in images and videos from the s ,288,,False,0.0,0.0,Neutral
1326902108965253121,2020-11-12 14:58:10,celebrating those who find selfexpression through rollerskating playing basketball longboarding or breakdancing ,403,,False,0.0,0.0,Neutral
1326630780110581767,2020-11-11 21:00:00,set in an office in the  the new guccigift campaign features characters impatiently waiting to the end of the ,287,,False,0.6772727272727272,-0.03181818181818183,Negative
1326570382938279948,2020-11-11 17:00:00,the ggmarmont shoulder bag a house signature defined by matelassé and double g hardware takes on a festive holid ,497,,False,0.0,0.0,Neutral
1326509988769009664,2020-11-11 13:00:01,from the guccigift collection the gucciophidia backpack mini bag and totes combine classic house motifs such as ,334,,False,0.3333333333333333,0.08333333333333333,Positive
1326268393482186753,2020-11-10 21:00:00,channeling the retro vibe of office parties from decades past the new guccigift campaign showcases the sparking r ,320,,False,0.3522727272727273,-0.05681818181818182,Negative
1326208004899758081,2020-11-10 17:00:02,festive gifts include ggmarmont slippers featuring the double g hardware and colorful sequins discover more ,331,,False,0.3,0.26666666666666666,Positive
1326147602426056704,2020-11-10 13:00:01,the new guccigift collection is part of the holiday celebrations bringing warmth and sparkle to the vintagelooki ,433,,False,0.45454545454545453,0.13636363636363635,Positive
1325906008355594240,2020-11-09 21:00:01,revealed in a new campaign set in a holiday office party in the s the guccigift lineup includes readytowear a ,478,,False,0.45454545454545453,0.13636363636363635,Positive
1325853871785340928,2020-11-09 17:32:50,holiday party set in the where the workplace becomes an impromptu mix of dance floor nightclub and bar is the ,930,,False,0.0,0.0,Neutral
1325787279630213120,2020-11-09 13:08:14,debuting the houses new guccigift campaign channeling the retro vibe of holiday office parties in the  conce ,410,,False,0.45454545454545453,0.13636363636363635,Positive
1325543616366850048,2020-11-08 21:00:00,a gallery of images from the gucciabsolutebeginners films directed by arloparks and yoshi to celebrate the ser ,387,,False,0.0,0.0,Neutral
1325483221182685185,2020-11-08 17:00:00,part of the gucciabsolutebeginners a series that challenged artists to direct their first film barrykeoghans  ,271,,False,0.3666666666666667,0.175,Positive
1325422820499755009,2020-11-08 13:00:00,seen here are stills from the gucciabsolutebeginners films by yoshi barrykeoghan lilygavin and arloparks to ,770,,False,0.0,0.0,Neutral
1325370022038999045,2020-11-08 09:30:12,onko chishin by yoshi is an exploration of self a story told through the streets of the tokyo district where he ,302,,False,0.0,0.0,Neutral
1325198535827075073,2020-11-07 22:08:46,for gucciabsolutebeginners lilygavin directed the companion a story about the wondrous possibilities that lie ,379,,False,0.0,0.0,Neutral
1325063005755875328,2020-11-07 13:10:13,gucciabsolutebeginners is a short film series in collaboration with which sees nine artists direct a film f ,380,,False,0.35,0.05,Positive
1324724895666872322,2020-11-06 14:46:41,announcing the emerging designers whose short films will be screened on guccifest ahluwalia shanelcampbell ,319,,False,0.3,0.0,Neutral
1324709373944434690,2020-11-06 13:45:01,screening alongside the episodes of gucciouverture of something that never ended part of guccifest will be fa ,491,,False,0.0,0.0,Neutral
1324380962210328576,2020-11-05 16:00:01,directors gusvansant and alessandromichele in an image by paigepowell on set in rome filming the episodes of ,682,,False,0.0,0.0,Neutral
1324283418172137474,2020-11-05 09:32:25,starring in gucciouverture the episode miniseries featuring the new collection presented during guccifest ,21815,,False,0.45454545454545453,0.13636363636363635,Positive
1324275027534032898,2020-11-05 08:59:05,announcing the premiere of gucciouverture of something that never ended the miniseries in episodes featuring t ,779,,False,0.0,0.0,Neutral
1324124264056979456,2020-11-04 23:00:00,styled with oversize tailoring or a tshirt tucked into trousers the ggmarmont collection of handbags defined by ,392,,False,0.0,0.0,Neutral
1324101615201255424,2020-11-04 21:30:00,defined by the double g hardware and matelassé leather looking at new accessories from the ggmarmont collection i ,499,,False,0.22727272727272727,0.06818181818181818,Positive
1324041746523840513,2020-11-04 17:32:06,the gucciepilogue collection is designed by alessandromichele to be worn again and again transcending fashion tr ,327,,False,0.0,0.0,Neutral
1323701480084414465,2020-11-03 19:00:00,josh o connor wears a look designed by alessandromichele for the november issue of ,548,,False,0.0,0.0,Neutral
1323610884569260033,2020-11-03 13:00:01,elle fanning carried a bag designed by alessandromichele with multiple ways to style it while de ,670,,False,0.0,0.0,Neutral
1323546735956926464,2020-11-03 08:45:06,on   and  all wear gucci and hold the new  ,518,,False,0.45454545454545453,0.13636363636363635,Positive
1323342339063140352,2020-11-02 19:12:54,on  loudoillon claraluciani and axelledoué all wear gucci and hold the new ,448,,False,0.45454545454545453,0.13636363636363635,Positive
1323006901521543168,2020-11-01 21:00:00,via different mediums creatives were invited by the house to recreate gucci sneaker designs for the ,455,,False,0.6,0.0,Neutral
1322886110742130693,2020-11-01 13:00:01,rolling up the door to the guccisneakergarage a new destination on the gucci app features a mix of storytelling ,296,,False,0.45454545454545453,0.13636363636363635,Positive
1322832159661527042,2020-11-01 09:25:38,from the guccisneakergarage the houses first virtual hightop gucci virtual and other sneaker designs are avai ,297,,False,0.35416666666666663,0.0625,Positive
1322597680380608513,2020-10-31 17:53:54,gucciabsolutebeginners nine creatives turn firsttime directors for a series of short films seen here are stills ,542,,False,0.3,0.0,Neutral
1322584121659387904,2020-10-31 17:00:01,presenting the guccisneakergarage featuring a mix of designs gaming usergenerated content as well as unveiling ,382,,False,0.0,0.0,Neutral
1322312326670942211,2020-10-30 23:00:00,emmacorrin ellefanning jodiesmith and are the first five gucciabsolutebeginnersthe fil ,488,,False,0.3333333333333333,0.25,Positive
1322282129045291008,2020-10-30 21:00:01,the concept came from someone i was seeing who told me that the risk of falling in love was greater than the rewar ,298,,False,0.55,0.5,Positive
1322221730534842369,2020-10-30 17:00:00,part of the first five gucciabsolutebeginners films released now is unity call by   ,201,,False,0.3333333333333333,0.25,Positive
1322161335531114497,2020-10-30 13:00:01,i loved being on the other side of the camera im fascinated by the study of light and perspectives said benede ,423,,False,0.625,0.325,Positive
1322106375422529536,2020-10-30 09:21:38,for gucciabsolutebeginners and gucci challenged nine artists to try something new for the first time act ,249,,False,0.3939393939393939,0.19318181818181818,Positive
1321919741020278785,2020-10-29 21:00:00,i loved the idea of trying to make a fiveminute western using all the recognisable tropes of the genre but then ,404,,False,0.4,0.35,Positive
1321844244844261376,2020-10-29 16:00:01,challenging artists to try something new gucciabsolutebeginners is a film series in collaboration with tha ,193,,False,0.7272727272727273,0.3181818181818182,Positive
1321799903560060928,2020-10-29 13:03:49,jackie is about a woman who is alone but not lonely in her home her sanctuary she chooses to remain uninterrup ,597,,False,0.7,0.04999999999999999,Positive
1321755077007319040,2020-10-29 10:05:42,for gucciabsolutebeginners jodiesmith presents jackie a film inspired by a woman who uses costume as her escap ,238,,False,0.0,0.0,Neutral
1321572451944452096,2020-10-28 22:00:00,on her directorial debut for gucciabsolutebeginners ellefanning said growing up on film sets watching director ,596,,False,0.0,0.0,Neutral
1321518961779970049,2020-10-28 18:27:27,presenting gucciabsolutebeginners a short film series in collaboration with where nine creatives turn firs ,559,,False,0.3,0.0,Neutral
1321436562157195266,2020-10-28 13:00:02,statues found and sketched in rome by artist and director gusvansant one of which is inspired by the turtle foun ,397,,False,0.0,0.0,Neutral
1321406354930733057,2020-10-28 11:00:00,portrait in rome a polaroid of gusvansant and alessandromichele in rome by paige powell gucciouverture ,337,,False,0.0,0.0,Neutral
1321371852321837058,2020-10-28 08:42:54,impressions of rome drawn by artist and director gusvansant gucciouverture alessandromichele ,450,,False,0.0,0.0,Neutral
1321240265928048641,2020-10-28 00:00:01,winner of the artist of the year  wore a gucciliberty floral printed bowling shirt ,204,,False,0.0,0.0,Neutral
1321195096436547584,2020-10-27 21:00:32,for her where do we go the livestream concert and both wore custom gucci looks the ,365,,False,0.0,0.0,Neutral
1321137780454531072,2020-10-27 17:12:47,scenes from his new music video golden appears in custom gucci styled by  ,24602,,False,0.4772727272727273,0.21818181818181817,Positive
1320998671056392192,2020-10-27 08:00:00,gucciepilogue was conceived by alessandromichele as the final act of the story of leaving behind fashions old ru ,414,,False,0.6333333333333333,-0.10000000000000002,Negative
1320862777666347008,2020-10-26 23:00:01,new readytowear looks including a striped motif from the ken scott archives over pants and a long sleeve blouse f ,467,,False,0.42727272727272725,0.043181818181818175,Positive
1320806150107877376,2020-10-26 19:15:00,worn here is a new readytowear look styled with a new handbag featuring a new disneyxgucci pattern with donald d ,475,,False,0.45454545454545453,0.13636363636363635,Positive
1320772179768860680,2020-10-26 17:00:01,shot in rome during a twelvehour live stream in july  for gucciepilogue creative director alessandromichele ,427,,False,0.75,0.3181818181818182,Positive
1320711781979836416,2020-10-26 13:00:01,gucciepilogue is alessandromicheles new collection a proposal to approach fashion in a new way with pieces desi ,533,,False,0.45454545454545453,0.13636363636363635,Positive
1320444243526242304,2020-10-25 19:16:54,the gucciepilogue lineup reveals all the elements that have guided the gucci aesthetic over the last years what ,537,,False,0.06666666666666667,0.0,Neutral
1320352475900239874,2020-10-25 13:12:15,breaking the spell that forces my collaborators to passionately work on clothes they later have to abandon i ask ,552,,False,0.42500000000000004,-0.025,Negative
1320140247309615104,2020-10-24 23:08:56,debuting the gucciepilogue campaign video filmed by directors damianodinnocenzo and fabiodinnocenzo epilogue is ,459,,False,0.0,0.0,Neutral
1320109694816538627,2020-10-24 21:07:32,in lieu of traditional models the gucciepilogue collection is captured by alecsoth on members of guccis design ,372,,False,0.75,0.0,Neutral
1320083318625521668,2020-10-24 19:22:43,images from the set anticipate the unveiling of the gucciepilogue campaign shot throughout the course of one day ,388,,False,0.0,0.0,Neutral
1320033614965374976,2020-10-24 16:05:13,gucciepilogue greens the new campaign conceived by alessandromichele and shot in july during a twelvehour strea ,324,,False,0.45454545454545453,0.13636363636363635,Positive
1319700116803080192,2020-10-23 18:00:01,props from the making of the new gucciepilogue campaignlaunching sooninclude a variety of vegetables captured ph ,408,,False,0.45454545454545453,0.13636363636363635,Positive
1319609522927902720,2020-10-23 12:00:02,photographer bruce gilden captures purplefashionmagazines the love issue cover story styled by ,360,,False,0.6,0.5,Positive
1319544223868342273,2020-10-23 07:40:33,discover how recreated guccioffthegrid pieces from the sustainablymade collection available for ,189,,False,0.4,0.4,Positive
1319542652241612800,2020-10-23 07:34:18,see how community member speed built the treehouse from the guccioffthegrid campaign for playe ,163,,False,0.0,0.0,Neutral
1319326239186952195,2020-10-22 17:14:21,digitally recreated pieces from guccioffthegrid by  which can be downloaded by players ,829,,False,0.0,0.0,Neutral
1319313571675852806,2020-10-22 16:24:01, issue features captured in her native tel aviv by michalchelbin she is styled by ,348,,False,0.0,0.0,Neutral
1319250460507779073,2020-10-22 12:13:14,exploring the treehouse from the guccioffthegrid campaign recreated by for   ,4973,,False,0.0,0.0,Neutral
1318948428458659842,2020-10-21 16:13:04,announcing a partnership for the firstever playermade gaming collaboration focused on sustainability with gucci ,4422,,False,0.0,0.0,Neutral
1318903472482385925,2020-10-21 13:14:26,in s fall issue dodo wears a gucci check cotton lamé suit with crewneck sweater and check shirt th ,577,,False,0.0,0.0,Neutral
1318818475264118784,2020-10-21 07:36:41,shot during a twelvehour live stream in july  for gucciepilogue creative director alessandromichele reveale ,366,,False,0.75,0.3181818181818182,Positive
1318602166416908289,2020-10-20 17:17:09,opening s first livestreamed concert the gucciepilogue campaigntogether with other videos creati ,679,,False,0.35416666666666663,0.0625,Positive
1318205264970088450,2020-10-19 15:00:00,captured by inside the latemannerist palazzo sacchetti in rome a chickenan animal featuring in t ,323,,False,0.0,0.0,Neutral
1317948572822884355,2020-10-18 22:00:00,step into guccibeautys theatrical realm of celestial magic with and holiday carol melodies to di ,529,,False,0.5,0.25,Positive
1317918374119329793,2020-10-18 20:00:00,introducing guccibeauty holiday spectacular the new festive campaign featuring singer songwriter  ,376,,False,0.6772727272727272,0.36818181818181817,Positive
1317857974854029318,2020-10-18 16:00:00,in a video by jordanhemingway floats to dreamlike melodies of holiday carols in an atmosphere of ,421,,False,0.0,0.0,Neutral
1317450294901547008,2020-10-17 13:00:02,leeperry appears on kaleidoscopemagazines latest cover wearing a gucci look featuring a printed cotton overshir ,325,,False,0.9,0.5,Positive
1317133202893529089,2020-10-16 16:00:01,to the in los angeles winner of three awards including top female artist wore a custo ,474,,False,0.3333333333333333,0.25,Positive
1317079457128206336,2020-10-16 12:26:27,winner of four awards including top hot song attended the wearing a custom gucci leather pr ,178,,False,0.675,0.375,Positive
1317014879325310979,2020-10-16 08:09:50,ellefanning appears in the september issue of wearing a look by alessandromichele ,440,,False,0.0,0.0,Neutral
1316844227846983680,2020-10-15 20:51:44,seen in s latest issue kai wears a look from the latest collection styled with a guccifakenot suitcas ,21608,,False,0.9,0.5,Positive
1316777391868571649,2020-10-15 16:26:09, today the global boyhood initiative cofounded by and its usbased nonprofit partner  wit,0,,False,0.0,0.0,Neutral
1316775501294456833,2020-10-15 16:18:38, features in s november issue wearing gucci readytowear pieces designed by ,1857,,False,0.0,0.0,Neutral
1316710412914626562,2020-10-15 12:00:00,up close with new leather loafers featuring tassels and with house elementsthe web stripe and shiny interlocking g ,573,,False,0.45454545454545453,0.13636363636363635,Positive
1316438627514159105,2020-10-14 18:00:01,designed in smooth leather and the house monogram the card case wallet features distinctive har ,549,,False,0.5,0.4,Positive
1316357796582100993,2020-10-14 12:38:50,the double g buckle is a key emblem of the house here used on a leather belt designed by alessandromichele disc ,591,,False,0.5,0.0,Neutral
1316072975880327168,2020-10-13 17:47:03,a printed green and red stripea reinterpretation of the webenriches guccifakenot pouches and wallets reinforcin ,308,,False,0.15,-0.1,Negative
1316038030499753990,2020-10-13 15:28:11, when we talk about nature and climate we tend to think of nature as a victim of climate but in reality nature can be an,0,,False,0.05,-0.07500000000000001,Negative
1315986816483426311,2020-10-13 12:04:41,gucciace sneakers feature an ironic wordplay bearing the word fake in capital letters against a reinterpretation ,495,,False,0.95,-0.15,Negative
1315710485984169986,2020-10-12 17:46:39,a playful take on distinctive house codes the words fake and not are displayed onto gg canvas crafted into va ,456,,False,1.0,-0.5,Negative
1315376395900645377,2020-10-11 19:39:05,recipient of the asia changemaker award chrislee and songyanfei both wearing gucci at the first digit ,488,,False,0.3333333333333333,0.25,Positive
1315279875180236800,2020-10-11 13:15:33,to the first digital gcfaitalia hosted by and  who performed at the eventwore a ,240,,False,0.16666666666666666,0.125,Positive
1314921641546256385,2020-10-10 13:32:04,images from musemagazines latest issue featuring actress benedettaporcaroli in looks from the ,518,,False,0.9,0.5,Positive
