id,created_at,text,likes,in reply to,retweeted,Subjectivity,Polarity,Analysis
1230109459739004928,2020-02-19 12:38:44,handwritten in italian by alessandromichele un rito che non ammette repliche which translates to an unrepeatab ,279,,False,0.0,0.0,Neutral
1230084826641895426,2020-02-19 11:00:51,to the britawards wore a georgette gown with pointed collar crystal and sequin embroidery ,178,,False,0.0,0.0,Neutral
1230074507697819648,2020-02-19 10:19:50,performing falling at the britawards wore a custom gucci ivory lace shirt with lace high waist tr ,10624,,False,0.5399999999999999,0.16,Positive
1230070251867561985,2020-02-19 10:02:56, wore a wool jacket and matching pants shirt with embroidery detail collar and felted woo ,8583,,False,0.0,0.0,Neutral
1229863726087647234,2020-02-18 20:22:16,a tribute to the fashion circuit guccitheritual watch the womens fashion show by alessandromichele ,424,,False,0.0,0.0,Neutral
1229727528396431360,2020-02-18 11:21:04,inside a dollhouse guccitheritual the womens fashion show by alessandromichele will be held at the ,466,,False,0.0,0.0,Neutral
1229433816898396160,2020-02-17 15:53:58,mysterious scenes featuring porcelain dolls in the leadup to the womens fashion show by ,368,,False,1.0,0.0,Neutral
1229423338080100360,2020-02-17 15:12:20, wore a tracksuit with gg profile detail in chicago where gucci opened the new guccipin temporar ,193,,False,0.45454545454545453,0.13636363636363635,Positive
1229149063888670725,2020-02-16 21:02:27,inside the nightclub themed space of the chicago guccipin  with marcobizzarri president and ceo of gucci ,258,,False,0.0,0.0,Neutral
1229142022872797184,2020-02-16 20:34:29,looking inside the guccipin temporary store in chicago which features the ggpsychedelic collection by ,685,,False,0.0,0.0,Neutral
1229114064514822144,2020-02-16 18:43:23,around the mirror ball at the opening of the guccipin  temporary store in chicago with guests polog ,225,,False,0.0,0.0,Neutral
1229113890560233473,2020-02-16 18:42:41,celebrating the guccipin  store in chicago featuring the ggpsychedelic colllection with guests spikelee ,261,,False,0.0,0.0,Neutral
1228650338426769408,2020-02-15 12:00:42,nightloving creatures the cast of the imaginary ggpsychedelic club are captured in vintagestyle photos wearing ,238,,False,0.0,0.0,Neutral
1228589861965303809,2020-02-15 08:00:23,the pictures from the ggpsychedelic campaign take their cue from the spirit of the colorful lineup designed by ,194,,False,0.4,0.3,Positive
1228469137636241409,2020-02-15 00:00:40,inside the ggpsychedelic club slides slipons and gucciace sneakers feature the gg and stars print designed by ,228,,False,0.0,0.0,Neutral
1228439000580546561,2020-02-14 22:00:55,a retro lively atmosphere defines the ggpsychedelic campaign to present alessandromichele latest collection a h ,186,,False,0.4666666666666666,0.21212121212121213,Positive
1228393799061245968,2020-02-14 19:01:18,on the dancefloor of the ggpsychedelic campaign the multicolored collection designed by alessandromichele unfold ,208,,False,0.0,0.0,Neutral
1228345504368615424,2020-02-14 15:49:24,imagined as gifts for valentinesday the guccidionysus bag features an exclusive hearts and stars print that alte ,571,,False,0.0,0.0,Neutral
1228333555299815424,2020-02-14 15:01:55,channeling the spirit of an imaginary nightclub in the  imagery from the ggpsychedelic campaign unveil the spe ,226,,False,0.0,0.0,Neutral
1228273951798939654,2020-02-14 11:05:04,referencing the ultimate visual medium of the club scenes instantphotostyle compositions highlight the ,252,,False,0.5,0.0,Neutral
1228061519688105984,2020-02-13 21:00:57,giant mirrored walls and flashing lights shine a spotlight on the ggpsychedelic bucket bag from the new special co ,193,,False,0.6753246753246754,0.1645021645021645,Positive
1228001312979156992,2020-02-13 17:01:42,playing with visual distortion and wide color spectrums the ggpsychedelic campaign showcases the collections key ,210,,False,0.4666666666666666,-0.03333333333333333,Negative
1227968395964026880,2020-02-13 14:50:54,reflecting the lights from mirror balls in an imaginary nightclub inspired by the club scene in new york in the  ,244,,False,0.45454545454545453,0.13636363636363635,Positive
1227899302082727936,2020-02-13 10:16:21,hypnotizing and surreal multiple shots are combined in the ggpsychedelic campaign photographed by ,348,,False,0.5,0.125,Positive
1227653886133047303,2020-02-12 18:01:09,hypnotizing and surreal multiple shots are combined in the ggpsychedelic campaign photographed by ,297,,False,0.5,0.125,Positive
1227633295912992768,2020-02-12 16:39:20,marcobizzarri president and ceo of gucci is captured in an intimate image by artist jrmemories from the party ,178,,False,0.6,0.2,Positive
1227626284722860035,2020-02-12 16:11:29,dakotajohnson wearing a dress by alessandromichele in an image by artist jrmemories from the party ,917,,False,0.0,0.0,Neutral
1227604015757889536,2020-02-12 14:42:59, wore a silk dress with plunging neckline metal horsebit chain detail and front slit with gold ,233,,False,0.0,0.0,Neutral
1227502758393069570,2020-02-12 08:00:38,a guest at the vfoscars party pinault wore a allover sequin dress with crystalembro ,252,,False,0.0,0.0,Neutral
1227366906182631425,2020-02-11 23:00:48,to the vfoscars party jakegyllenhaal wore a gucci onebutton heritage tuxedo evening shirt and leather laceup ,374,,False,0.0,0.0,Neutral
1227336760709001219,2020-02-11 21:01:01,at the vfoscars party wore a guccidiy madetoorder doublebreasted peak lapel signoria tuxedo wit ,161,,False,0.0,0.0,Neutral
1227306589180321794,2020-02-11 19:01:07, attended the vfoscars party in a guccidiy madetoorder velvet onebutton satin shawl lapel evening ,215,,False,0.0,0.0,Neutral
1227254961387405312,2020-02-11 15:35:58,moments before the oscars saoirseronan was captured wearing a selection of guccihighjewelry pieces in white gol ,762,,False,0.0,0.0,Neutral
1227196035782651904,2020-02-11 11:41:49,on the red carpet of awards wore a threepiece suit evening shirt grosgrain ,1575,,False,0.0,0.0,Neutral
1227152059704709127,2020-02-11 08:47:05,pictured at awards stellabanderas in a gucci patent leather and silk deep vneck gown with leat ,388,,False,0.4,0.0,Neutral
1226980760160231427,2020-02-10 21:26:24,attending the annual awards quentintarantinonominee for best director for ,214,,False,0.3,1.0,Positive
1226929418376970244,2020-02-10 18:02:23,presenter at awards pinault wore a custom gucci silk georgette one shoulder gown with ,758,,False,0.0,0.0,Neutral
1226905983458381824,2020-02-10 16:29:15,to the awards wore a velvet doublebreasted peak lapel signoria tuxedo with ,183,,False,0.0,0.0,Neutral
1226837982973505537,2020-02-10 11:59:03,winner of best original song for  love me again from at awards ,1658,,False,0.5499999999999999,0.625,Positive
1226807472209514497,2020-02-10 09:57:49,performing at awards and attending the vfoscars party wore a custom crystal embell ,516,,False,0.0,0.0,Neutral
1226801413151432704,2020-02-10 09:33:44,at awards  spikelee wore a custom gucci purple lapel heritage suit and  patches on the lapel ,243,,False,0.0,0.0,Neutral
1226799378138107905,2020-02-10 09:25:39,on the red carpet at awards saoirseronan nominated for a best actress award for  in ,320,,False,0.15,0.5,Positive
1226798146036142081,2020-02-10 09:20:45,at a party for new restaurant gucciosteria da massimo bottura in beverly hills guests wore gucci tessathompson ,187,,False,0.45454545454545453,0.13636363636363635,Positive
1226797728560295936,2020-02-10 09:19:05,celebrating the new gucciosteria da massimo bottura restaurant in beverly hills guests included michelinstarred ,160,,False,0.45454545454545453,0.13636363636363635,Positive
1226636437065523202,2020-02-09 22:38:11,at  every night achillelauro paid homage to characters who inspired him through different ,548,,False,0.6,0.0,Neutral
1226632732572340225,2020-02-09 22:23:27,for his third performance at  achillelauro interpreted marchesa luisa casati stampaa hei ,375,,False,0.0,0.0,Neutral
1226400383909711872,2020-02-09 07:00:11,on a tram in italy for accidentalinfluencer a group of boys wear the same dark cotton sneaker t ,515,,False,0.2625,-0.075,Negative
1226294730247503878,2020-02-09 00:00:21,accidentalinfluencer is a portfolio of images imagining similar looking people sharing a passion for the same shoe ,274,,False,0.2625,0.0,Neutral
1226234416462278656,2020-02-08 20:00:41,captured in everyday situations seemingly identical people wear the sneakersa new design by ,208,,False,0.5272727272727272,-0.03181818181818183,Negative
1226174089905176581,2020-02-08 16:00:58,a retrostyle label and the house web stripe define the  a new lowtop sneaker designed by ,519,,False,0.45454545454545453,0.13636363636363635,Positive
1226113657622421504,2020-02-08 12:00:50,seen in images from accidentallnfluencer a group of lookalikes is captured wearing similar looks and the same pai ,451,,False,0.2625,0.0,Neutral
1226053136944713728,2020-02-08 08:00:21,combining different house codes including the house web stripe and a textured gg motif on the sole the ,294,,False,0.425,0.0,Neutral
1226007782379474945,2020-02-08 05:00:08,accidentalinfluencer presents the sneaker as the musthave of the season the new design by ,315,,False,0.45454545454545453,0.13636363636363635,Positive
1225932416382095361,2020-02-08 00:00:39,improbable coincidences turn into hypnotic imagery for accidentalinfluencer the new series to present the ,424,,False,0.22727272727272727,0.06818181818181818,Positive
1225872226764939264,2020-02-07 20:01:29,wearing similar outfitsand the sneakergroups of lookalikes are pictured in spontaneous moments f ,321,,False,0.65,0.3,Positive
1225823217815891973,2020-02-07 16:46:44,captured backstage at music festival in sanremo italy achillelauro wore a guccibeauty ,374,,False,0.0,0.0,Neutral
1225811925675757569,2020-02-07 16:01:52,inspired by the sneaker accidentalinfluencer presents imagery featuring seemingly identical peop ,339,,False,0.0,0.0,Neutral
1225732806153768960,2020-02-07 10:47:28,spontaneous moments reveal alessandromicheles new sneaker design  the imagery from ,298,,False,0.6772727272727272,0.36818181818181817,Positive
1225710184686923777,2020-02-07 09:17:35,accidentalinfluencer presenting the new sneaker designed by alessandromichele captured by arti ,514,,False,0.45454545454545453,0.13636363636363635,Positive
1225607737490526208,2020-02-07 02:30:29,at music festival paid tribute to davidbowies alter ego ziggy stardust for his perform ,1576,,False,0.0,0.0,Neutral
1225479962326597632,2020-02-06 18:02:45,adwoaaboah wore halter dress with patent leather straps cut out details and side slit with platform s ,222,,False,0.0,0.0,Neutral
1225424982681018369,2020-02-06 14:24:17,to to discuss  wore a printed silk crêpe shirt wide leg flared pants w ,259,,False,0.4,-0.1,Negative
1225162430516486145,2020-02-05 21:01:00,performing at music festival and both wearing gucci by alessandromichele ,364,,False,0.0,0.0,Neutral
1225107142195236865,2020-02-05 17:21:18,on stage at the annual music festival took off his custom gucci velvet cape reveali ,400,,False,0.0,0.0,Neutral
1225059058769702913,2020-02-05 14:10:14,at  wore a custom gucci velvet cape with floral details over an embroidered mesh bodysuit ,460,,False,0.0,0.0,Neutral
1224981398441865216,2020-02-05 09:01:39, appears on s latest cover wearing a gg silk jacquard shirt with cotton wide pants with ,164,,False,0.65,0.2,Positive
1224845735633526785,2020-02-05 00:02:34,to the annual music festival wore a custom gucci cape with sequin details and an emb ,4969,,False,0.0,0.0,Neutral
1224665727438917639,2020-02-04 12:07:17,starring by noahbaumbachthe directors issue by features debbieharry in by ,650,,False,0.0,0.0,Neutral
1224363179037413378,2020-02-03 16:05:04,styled by alexharrington and shot by harleyweir inside wears looks from  ,781,,False,0.0,0.0,Neutral
1224362702132469761,2020-02-03 16:03:10,for its march issue commissioned three covers from different photographers including hassanhajjaj ,623,,False,0.6,0.0,Neutral
1224323391517274113,2020-02-03 13:26:58,at the in london nominee kelvinharrisonjr wore a gucci two button jacket evening shirt trou ,203,,False,0.0,0.0,Neutral
1224280324093489152,2020-02-03 10:35:49,to the british academy film awards  nominees gretagerwig and noahbaumbach both in gucci by ,173,,False,0.0,0.0,Neutral
1224272567189540864,2020-02-03 10:05:00,to the at the royal albert hall in london presenter and  jodieturnersmith wore a cu ,419,,False,0.0,0.0,Neutral
1224259759060267009,2020-02-03 09:14:06,at the in london nominee wore a custom gucci lamé gown with crystal embroidery leather p ,134,,False,0.0,0.0,Neutral
1224257307359490049,2020-02-03 09:04:22,winner of the ee rising star award michealward wore a gucci satin heritage tuxedo evening shirt with bib ,181,,False,0.0,0.0,Neutral
1224082591747399680,2020-02-02 21:30:06,nominee saoirseronan captured at the in a custom gucci duchesse silk thin strap gown she completed her lo ,310,,False,0.8500000000000001,-0.4,Negative
1224075149072306178,2020-02-02 21:00:32,looking at the guccibeauty lipstick collections by alessandromichele including the new rouge à lèvres gothique wi ,350,,False,0.45454545454545453,0.13636363636363635,Positive
1223954390429716481,2020-02-02 13:00:41,guccibeauty rouge à lèvres gothique is created in a contemporary palette of nine specially pigmented colours that ,327,,False,0.369047619047619,0.2619047619047619,Positive
1223712780940992512,2020-02-01 21:00:37,an image from the guccibeautynetwork campaign features model maelapres applying the new rouge à lèvres gothique l ,269,,False,0.45454545454545453,0.13636363636363635,Positive
1223607243855278081,2020-02-01 14:01:15,intriguing and unconventional guccibeauty rouge à lèvres gothique reveals a modern look worn here by musicians ,255,,False,0.35,0.25,Positive
1223592057408827393,2020-02-01 13:00:54,musicians dani miller and jeffertitti discuss breaking the rules of beauty norms in a new guccipodcast episode li ,202,,False,0.45454545454545453,0.13636363636363635,Positive
1223516468601655296,2020-02-01 08:00:32,introducing the new guccibeauty lipstick collection rouge à lèvres gothique by alessandromichele captured in the ,389,,False,0.45454545454545453,0.13636363636363635,Positive
1223350486960693249,2020-01-31 21:00:59, wore a oversized doublebreasted suit with a striped shirt to the universalmusicgroup ,201,,False,0.0,0.0,Neutral
1223290290368401409,2020-01-31 17:01:47,arriving at the bbcradio studio to present  jodieturnersmith wore a cady wool silk ,232,,False,0.0,0.0,Neutral
1223239721297567745,2020-01-31 13:40:50,to the universalmusicgroup grammys after party wore a gg wool bomber jacket and pan ,718,,False,0.0,0.0,Neutral
1223018262218362880,2020-01-30 23:00:50,mens looks from by alessandromichele include a tracksuit and a padded nylon coat enriched with an ,267,,False,0.0,0.0,Neutral
1222957948768485378,2020-01-30 19:01:11,crafted in diverse materials the gucciultrapace sneaker designed by alessandromichele features various house det ,399,,False,0.5,0.0,Neutral
1222906080998633472,2020-01-30 15:35:04,the web stripe details a mix of activewear for new looks styled with unexpected oversized ,345,,False,0.7272727272727273,0.11818181818181818,Positive
1222595539268788225,2020-01-29 19:01:05,defined by a narrow goldtoned metal chain and buckle detail and completed with a detachable and adjustable shoulde ,285,,False,0.4,-0.2,Negative
1222489749736304644,2020-01-29 12:00:43,moments before oscarslunch yesterday in los angeles gretagerwig was captured by cristinaehrlich wea ,254,,False,0.0,0.0,Neutral
1222233138514055169,2020-01-28 19:01:02,seen in the campaign ofcourseahorse captured by yorgoslanthimos the new bag designed ,196,,False,0.45454545454545453,0.13636363636363635,Positive
1222222832832258050,2020-01-28 18:20:05,attending the grammys nominee guccimane and gucci manea face from the c ,1777,,False,0.0,0.0,Neutral
1222216630845038594,2020-01-28 17:55:27,performing at the grammys winner of best pop duogroup performance and best music videowore a custo ,374,,False,0.3,1.0,Positive
1222156538611163136,2020-01-28 13:56:40,animated film sitara let girls dream by academy and emmy awardwinning director sharmeenobaidchinoy was screen ,177,,False,0.0,0.0,Neutral
1222118251422978048,2020-01-28 11:24:31,at the grammys winner of best rb album for ventura and best rb performance for come home andersonpaak ,230,,False,0.3,1.0,Positive
1222085121521725440,2020-01-28 09:12:52,recipient of the s lifetime achievement award who stars in the campaign ,201,,False,0.0,0.0,Neutral
1221915959188971522,2020-01-27 22:00:41, and performing together at the grammys both wore custom gucci crystal gg embroidered pie ,1102,,False,0.0,0.0,Neutral
1221872821862850560,2020-01-27 19:09:16,winner of five grammys wore a gucci velvet evening jacket with multicolor flower embroidery evening sh ,3310,,False,0.0,0.0,Neutral
1221840171429220369,2020-01-27 16:59:32,performing at the grammys wore a custom gucci crystal gg embroidered shirt and matching pants she ,626,,False,0.0,0.0,Neutral
1221806975861821440,2020-01-27 14:47:37,winner of five grammy awards including best new artist and song of the year attended the in ,1622,,False,0.37727272727272726,0.5681818181818181,Positive
1221746087939186689,2020-01-27 10:45:40,the first woman and second artist ever to win record of the year album of the year song of the year and be ,3576,,False,0.24444444444444446,0.35000000000000003,Positive
1221538457908105219,2020-01-26 21:00:38,presented in contrasting color combinations that alternate on the front and the back gg wool scarves are accentuat ,469,,False,0.0,0.0,Neutral
1221478158454665216,2020-01-26 17:01:01,designed with a thick sole the guccirhyton leather sneakers featuring playful prints from the coll ,477,,False,0.3625,-0.15000000000000002,Negative
1221417678277050368,2020-01-26 13:00:42,a playful twist on the houses monogram logo the gg apple print appears on a lineup of tshirts and sweatshirts fr ,370,,False,0.0,0.0,Neutral
1221176068511621120,2020-01-25 21:00:37,crafted in contrasting leather colors the bucket bags feature goldtoned toned hardware and an ,385,,False,0.0,0.0,Neutral
1221115831905595392,2020-01-25 17:01:16,from by alessandromichele midheel platform sandals featuring a chunky heel and guccizumi low hee ,449,,False,0.3,0.0,Neutral
1221106881214779393,2020-01-25 16:25:42,announcing guccis support for a campaign by to increase women in music through songwriting ,178,,False,0.0,0.0,Neutral
1221055344434204672,2020-01-25 13:00:54,styled with tweed readytowear pieces the bucket bag combines textured and soft leather disco ,417,,False,0.35,0.1,Positive
1220813832072912896,2020-01-24 21:01:13,featured in s february issue florencepugh wears a long sleeve embroidered gown from a ,359,,False,0.4,-0.05,Negative
1220693060616642560,2020-01-24 13:01:19, appears in the february issue of wearing a deepv neck long sleeve top and leather skir ,426,,False,0.45,0.225,Positive
1220451379388604418,2020-01-23 21:00:58, s january issue features saoirseronan wearing a selection of gucci pieces including a wool sweater ,574,,False,0.0,0.0,Neutral
1220345765618503680,2020-01-23 14:01:18,seen on voguemes february cover xiaozhan wears a bomber jacket striped shirt and printed tie from b ,4542,,False,0.0,0.0,Neutral
1220265459917971457,2020-01-23 08:42:11,at the in  president and ceo of gucci marcobizzarri and jennifermorgan coceo and member of the exe ,160,,False,0.0,0.0,Neutral
1220055918475431937,2020-01-22 18:49:33, appears on wearing a guccitailoring look featuring a doublebreasted jacket and flare pants fr ,320,,False,0.0,0.0,Neutral
1219934780248219653,2020-01-22 10:48:11,announced today in  joins gucci president and ceo marcobizzarris ceocarbonneutralchallenge open to ,154,,False,0.5,0.0,Neutral
1219726584409657346,2020-01-21 21:00:53,captured at the finn wolfhard wore a guccitailoring twobutton heritage tuxedo with grosgrai ,355,,False,0.0,0.0,Neutral
1219651348381216774,2020-01-21 16:01:56,to the awards bennysafdie and joshsafdie wore guccitailoring the brothers were nomin ,322,,False,0.0,0.0,Neutral
1219394330366029828,2020-01-20 23:00:38,to the screen actors guild awards  wore a gucci polka dot tulle gown with crystal embro ,340,,False,0.0,0.0,Neutral
1219349145137438721,2020-01-20 20:01:05,a downfilled jacket with gucciliberty print and a short dress with embroidered wide collar are see ,259,,False,0.35,-0.05,Negative
1219275483902287873,2020-01-20 15:08:23,gucci creative director alessandromichele captured backstage moments after the mens show discover mor ,345,,False,1.0,0.5,Positive
1219275021018857472,2020-01-20 15:06:32,from the backstage a doublebreasted blazer with print new guccieyewear designs and ch ,188,,False,0.45454545454545453,0.13636363636363635,Positive
1219031874292547585,2020-01-19 23:00:22,designs inspired by running shoes floral prints by and cutout details define the shoes lineup fro ,525,,False,0.0,0.0,Neutral
1218986666507034624,2020-01-19 20:00:43,among the accessories debuting on the mens runway crystal necklaces round acetate guccieyewear and e ,241,,False,0.4,-0.2,Negative
1218941434251939847,2020-01-19 17:00:59,handbags from  the guccijackie leather shoulder and crossbody styles a cubic box bag and the ,554,,False,0.0,0.0,Neutral
1218896097688670208,2020-01-19 14:00:50,walking on the sandy runway of the show a mens look featuring wide legged denim pants and a cropped kn ,246,,False,0.4,-0.1,Negative
1218805361379028992,2020-01-19 08:00:17,mon petita french term of affectionis printed on a sweater appearing on the runway discover more ,419,,False,0.25,0.25,Positive
1218669489987969024,2020-01-18 23:00:22,a childlike silhouette defines a coat with rounded collar seen on the mens runway discover more ,234,,False,0.5,0.5,Positive
1218579088778113025,2020-01-18 17:01:09,presented for the first time at the womens show the guccidionysus represents alessandromicheles con ,403,,False,0.3333333333333333,0.25,Positive
1218533784737517568,2020-01-18 14:01:08,illuminated with a crystal necklace a look from features a cardigan with argyle pattern worn with a dou ,267,,False,0.0,0.0,Neutral
1218442987010543618,2020-01-18 08:00:20,a sweater embroidered with a cauliflower and the words mon petit chou a french term of endearment meaning my litt ,309,,False,0.0,0.0,Neutral
1218216815127560193,2020-01-17 17:01:36,five years after alessandromicheles debut collection the mens fashion show revealed baby ,290,,False,0.0,0.0,Neutral
1218171542028410882,2020-01-17 14:01:42, lavazzas drive to reduce greenhouse gas emissions began years ago in taking up marco bizzarris invitation we will be rampi,0,,False,0.0,0.0,Neutral
1218090431952687104,2020-01-17 08:39:24,words overlay on tshirts from featuring artworks from psychoptsa book by richard hell and ,264,,False,0.0,0.0,Neutral
1217944807533879298,2020-01-16 23:00:45,lining up for the mens show layered plaid pieces the guccijackie shoulder bag and ripped denim disc ,281,,False,0.0,0.0,Neutral
1217929726788014082,2020-01-16 22:00:49,ripped wide legged jeans a distressed cropped sweater and a top handle bag featuring a print by ,240,,False,0.45,0.2,Positive
1217884496407728135,2020-01-16 19:01:05,designed by alessandromichele looks from the mens show including a gg suitcase featuring the word fa ,246,,False,0.0,0.0,Neutral
1217833914636668934,2020-01-16 15:40:06,while preparing for the mens show alessandromichele reflects to filmmaker yuriancarani on the new co ,561,,False,0.45454545454545453,0.13636363636363635,Positive
1217816343589900288,2020-01-16 14:30:16,from the mens backstage tstrap leather shoes with cutout details the shoulder ba ,242,,False,0.0,0.0,Neutral
1217790370878230533,2020-01-16 12:47:04,miyavileeishihara and who took over the guccibeauty instagram stories during the showatte ,833,,False,0.0,0.0,Neutral
1217787179860135937,2020-01-16 12:34:23, arriving at the mens show in milan discover more ,400,,False,0.5,0.5,Positive
1217766959271612416,2020-01-16 11:14:02,kelvin harrison jr and leo mandella photographed by brucegilden arriving to the ,175,,False,0.0,0.0,Neutral
1217762886996590592,2020-01-16 10:57:51, and captured moments before the mens show by alessandromichele discover more ,321,,False,0.5,0.5,Positive
1217741673763131392,2020-01-16 09:33:34,  tamumcpherson and at the mens fashion show in milan discover ,195,,False,0.0,0.0,Neutral
1217739673306587136,2020-01-16 09:25:37,guests at the show  adam bainbridge captured with phoebe collingsjames ,214,,False,0.0,0.0,Neutral
1217730717590937605,2020-01-16 08:50:02,  filipcustic and jeanjacquesndjoli wearing gucci by alessandromichele to the ,470,,False,0.0,0.0,Neutral
1217582427612307462,2020-01-15 23:00:46,gucci president and ceo marcobizzarri aleksandrgudkov williamcult and milovanfarronato arriving at the ,244,,False,0.0,0.0,Neutral
1217567322719780869,2020-01-15 22:00:45,guests at the mens show   and gogoboi wearing gucci by ,434,,False,0.0,0.0,Neutral
1217552251763548166,2020-01-15 21:00:52,singer and writer richardhellwhose artworks from psychopts a book in collaboration with christopherwool feat ,135,,False,0.0,0.0,Neutral
1217537256308776960,2020-01-15 20:01:17,kaifrom kpop groups and and professional surfer leonardofioravanti attending the ,16229,,False,0.1,0.1,Positive
1217520243616243712,2020-01-15 18:53:41, and arthurjafa photographed by brucegilden at the mens show in milan watch the sho ,235,,False,0.0,0.0,Neutral
1217514722746077184,2020-01-15 18:31:44,a guest at the mens show earlcave wore herringbone double breasted notch lapel new sig ,236,,False,0.22727272727272727,0.06818181818181818,Positive
1217495669885349894,2020-01-15 17:16:02,the story behind instagram profile things i have drawn creator of guccis instagram stories for the fall winter ,114,,False,0.7,-0.4,Negative
